openalex_id,year,title,abstract,text,cited_by_count
https://openalex.org/W4321486720,2023,On measuring inconsistency in definite and indefinite databases with denial constraints,"Real-world databases are often inconsistent. Although there has been an extensive body of work on handling inconsistency, little work has been done on measuring inconsistency in databases. In this paper, building on work done on measuring inconsistency in propositional knowledge bases, we explore inconsistency measures (IMs) for definite and indefinite databases with denial constraints. We first introduce database IMs that are inspired by well-established methods to quantify inconsistency in propositional knowledge bases, but are tailored to the relational database context where data is generally the reason for inconsistency, not the integrity constraints. Then, we analyze the compliance of the database IMs with rationality postulates for both definite and indefinite databases. Finally, we investigate the complexity of the inconsistency measurement problem as well as of the problems of deciding whether the inconsistency is lower than, greater than, or equal to a given threshold for both the definite and the indefinite cases.","On measuring inconsistency in definite and indefinite databases with denial constraints Real-world databases are often inconsistent. Although there has been an extensive body of work on handling inconsistency, little work has been done on measuring inconsistency in databases. In this paper, building on work done on measuring inconsistency in propositional knowledge bases, we explore inconsistency measures (IMs) for definite and indefinite databases with denial constraints. We first introduce database IMs that are inspired by well-established methods to quantify inconsistency in propositional knowledge bases, but are tailored to the relational database context where data is generally the reason for inconsistency, not the integrity constraints. Then, we analyze the compliance of the database IMs with rationality postulates for both definite and indefinite databases. Finally, we investigate the complexity of the inconsistency measurement problem as well as of the problems of deciding whether the inconsistency is lower than, greater than, or equal to a given threshold for both the definite and the indefinite cases.",9
https://openalex.org/W4366496760,2023,"ASP and subset minimality: Enumeration, cautious reasoning and MUSes","Answer Set Programming (ASP) is a well-known logic-based formalism that has been used to model and solve a variety of AI problems. For several years, ASP implementations primarily focused on the main computational task: the computation of one answer set of a (logic) program. Nonetheless, several AI problems, that can be conveniently modelled in ASP, require to enumerate solutions characterized by an optimality property that can be expressed in terms of subset-minimality with respect to some objective atoms. In this context, solutions are often either (i) answer sets that are subset-minimal w.r.t. the objective atoms or (ii) atoms that are contained in all subset-minimal answer sets, or (iii) sets of atoms that enforce the absence of answer sets on the ASP program at hand — such sets are referred to as minimal unsatisfiable subsets (MUSes). In all the above-mentioned cases, the corresponding computational task is currently not supported by plain state-of-the-art ASP solvers. In this paper, we study formally these tasks and fill the gap in current implementations by proposing several algorithms to enumerate MUSes and subset-minimal answer sets, as well as perform cautious reasoning on subset-minimal answer sets. We implement our algorithms on top of wasp and perform an experimental analysis on several hard benchmarks showing the good performance of our implementation.","ASP and subset minimality: Enumeration, cautious reasoning and MUSes Answer Set Programming (ASP) is a well-known logic-based formalism that has been used to model and solve a variety of AI problems. For several years, ASP implementations primarily focused on the main computational task: the computation of one answer set of a (logic) program. Nonetheless, several AI problems, that can be conveniently modelled in ASP, require to enumerate solutions characterized by an optimality property that can be expressed in terms of subset-minimality with respect to some objective atoms. In this context, solutions are often either (i) answer sets that are subset-minimal w.r.t. the objective atoms or (ii) atoms that are contained in all subset-minimal answer sets, or (iii) sets of atoms that enforce the absence of answer sets on the ASP program at hand — such sets are referred to as minimal unsatisfiable subsets (MUSes). In all the above-mentioned cases, the corresponding computational task is currently not supported by plain state-of-the-art ASP solvers. In this paper, we study formally these tasks and fill the gap in current implementations by proposing several algorithms to enumerate MUSes and subset-minimal answer sets, as well as perform cautious reasoning on subset-minimal answer sets. We implement our algorithms on top of wasp and perform an experimental analysis on several hard benchmarks showing the good performance of our implementation.",9
https://openalex.org/W4377030819,2023,Human performance consequences of normative and contrastive explanations: An experiment in machine learning for reliability maintenance,,Human performance consequences of normative and contrastive explanations: An experiment in machine learning for reliability maintenance,9
https://openalex.org/W4397001891,2024,Acquiring and modeling abstract commonsense knowledge via conceptualization,,Acquiring and modeling abstract commonsense knowledge via conceptualization,9
https://openalex.org/W2794629898,2018,Safe inductions and their applications in knowledge representation,,Safe inductions and their applications in knowledge representation,8
https://openalex.org/W3014119499,2020,"Compatibility, desirability, and the running intersection property",,"Compatibility, desirability, and the running intersection property",8
https://openalex.org/W3114036346,2022,Knowledge-based strategies for multi-agent teams playing against Nature,"We study teams of agents that play against Nature towards achieving a common objective. The agents are assumed to have imperfect information due to partial observability, and have no communication during the play of the game. We propose a natural notion of higher-order knowledge of agents. Based on this notion, we define a class of knowledge-based strategies, and consider the problem of synthesis of strategies of this class. We introduce a multi-agent extension, MKBSC, of the well-known knowledge-based subset construction applied to such games. Its iterative applications turn out to compute higher-order knowledge of the agents. We show how the MKBSC can be used for the design of knowledge-based strategy profiles, and investigate the transfer of existence of such strategies between the original game and in the iterated applications of the MKBSC, under some natural assumptions. We also relate and compare the “intensional” view on knowledge-based strategies based on explicit knowledge representation and update, with the “extensional” view on finite memory strategies based on finite transducers and show that, in a certain sense, these are equivalent.","Knowledge-based strategies for multi-agent teams playing against Nature We study teams of agents that play against Nature towards achieving a common objective. The agents are assumed to have imperfect information due to partial observability, and have no communication during the play of the game. We propose a natural notion of higher-order knowledge of agents. Based on this notion, we define a class of knowledge-based strategies, and consider the problem of synthesis of strategies of this class. We introduce a multi-agent extension, MKBSC, of the well-known knowledge-based subset construction applied to such games. Its iterative applications turn out to compute higher-order knowledge of the agents. We show how the MKBSC can be used for the design of knowledge-based strategy profiles, and investigate the transfer of existence of such strategies between the original game and in the iterated applications of the MKBSC, under some natural assumptions. We also relate and compare the “intensional” view on knowledge-based strategies based on explicit knowledge representation and update, with the “extensional” view on finite memory strategies based on finite transducers and show that, in a certain sense, these are equivalent.",8
https://openalex.org/W4294011232,2022,Risk verification of stochastic systems with neural network controllers,,Risk verification of stochastic systems with neural network controllers,8
https://openalex.org/W4320473640,2023,Accurate parameter estimation for safety-critical systems with unmodeled dynamics,,Accurate parameter estimation for safety-critical systems with unmodeled dynamics,8
https://openalex.org/W4384008764,2023,Fast and accurate data-driven goal recognition using process mining techniques,"The problem of goal recognition requests to automatically infer an accurate probability distribution over possible goals an autonomous agent is attempting to achieve in the environment. The state-of-the-art approaches for goal recognition operate under full knowledge of the environment and possible operations the agent can take. This knowledge, however, is often not available in real-world applications. Given historical observations of the agents' behaviors in the environment, we learn skill models that capture how the agents achieved the goals in the past. Next, given fresh observations of an agent, we infer their goals by diagnosing deviations between the observations and all the available skill models. We present a framework that serves as an outline for implementing such data-driven goal recognition systems and its instance system implemented using process mining techniques. The evaluations we conducted using our publicly available implementation confirm that the approach is well-defined, i.e., all system parameters impact its performance, has high accuracy over a wide range of synthetic and real-world domains, which is comparable with the more knowledge-demanding state-of-the-art approaches, and operates fast.","Fast and accurate data-driven goal recognition using process mining techniques The problem of goal recognition requests to automatically infer an accurate probability distribution over possible goals an autonomous agent is attempting to achieve in the environment. The state-of-the-art approaches for goal recognition operate under full knowledge of the environment and possible operations the agent can take. This knowledge, however, is often not available in real-world applications. Given historical observations of the agents' behaviors in the environment, we learn skill models that capture how the agents achieved the goals in the past. Next, given fresh observations of an agent, we infer their goals by diagnosing deviations between the observations and all the available skill models. We present a framework that serves as an outline for implementing such data-driven goal recognition systems and its instance system implemented using process mining techniques. The evaluations we conducted using our publicly available implementation confirm that the approach is well-defined, i.e., all system parameters impact its performance, has high accuracy over a wide range of synthetic and real-world domains, which is comparable with the more knowledge-demanding state-of-the-art approaches, and operates fast.",8
https://openalex.org/W601027804,2015,Automatic construction of optimal static sequential portfolios for AI planning and beyond,,Automatic construction of optimal static sequential portfolios for AI planning and beyond,8
https://openalex.org/W2996464769,2019,An Introduction to the Planning Domain Definition Language (PDDL): Book review,,An Introduction to the Planning Domain Definition Language (PDDL): Book review,7
https://openalex.org/W3042974867,2021,Toward personalized XAI: A case study in intelligent tutoring systems,,Toward personalized XAI: A case study in intelligent tutoring systems,7
https://openalex.org/W3117713512,2021,Logic Tensor Networks,,Logic Tensor Networks,7
https://openalex.org/W3176276744,2023,Better bounds on the adaptivity gap of influence maximization under full-adoption feedback,,Better bounds on the adaptivity gap of influence maximization under full-adoption feedback,7
https://openalex.org/W4300717047,2022,Convolutional spectral kernel learning with generalization guarantees,,Convolutional spectral kernel learning with generalization guarantees,7
https://openalex.org/W4320718721,2023,Post-trained convolution networks for single image super-resolution,,Post-trained convolution networks for single image super-resolution,7
https://openalex.org/W4362588063,2023,The first AI4TSP competition: Learning to solve stochastic routing problems,,The first AI4TSP competition: Learning to solve stochastic routing problems,7
https://openalex.org/W4379472738,2023,Spectral complexity-scaled generalisation bound of complex-valued neural networks,,Spectral complexity-scaled generalisation bound of complex-valued neural networks,7
https://openalex.org/W4393132112,2024,"Almost proportional allocations of indivisible chores: Computation, approximation and efficiency",,"Almost proportional allocations of indivisible chores: Computation, approximation and efficiency",7
https://openalex.org/W3133162735,2021,Predicting winner and estimating margin of victory in elections using sampling,,Predicting winner and estimating margin of victory in elections using sampling,6
https://openalex.org/W4309635285,2022,Regret minimization in online Bayesian persuasion: Handling adversarial receiver's types under full and partial feedback models,,Regret minimization in online Bayesian persuasion: Handling adversarial receiver's types under full and partial feedback models,6
https://openalex.org/W4386791028,2023,TEAMSTER: Model-based reinforcement learning for ad hoc teamwork,,TEAMSTER: Model-based reinforcement learning for ad hoc teamwork,6
https://openalex.org/W4387891985,2023,Distributed web hacking by adaptive consensus-based reinforcement learning,,Distributed web hacking by adaptive consensus-based reinforcement learning,6
https://openalex.org/W4388816578,2023,Pessimistic value iteration for multi-task data sharing in Offline Reinforcement Learning,,Pessimistic value iteration for multi-task data sharing in Offline Reinforcement Learning,6
https://openalex.org/W4392845094,2024,A differentiable first-order rule learner for inductive logic programming,,A differentiable first-order rule learner for inductive logic programming,6
https://openalex.org/W4401241445,2024,Manipulation and peer mechanisms: A survey,"In peer mechanisms, the competitors for a prize also determine who wins. Each competitor may be asked to rank, grade, or nominate peers for the prize. Since the prize can be valuable, such as financial aid, course grades, or an award at a conference, competitors may be tempted to manipulate the mechanism. We survey approaches to prevent or discourage the manipulation of peer mechanisms. We conclude our survey by identifying several important research challenges.","Manipulation and peer mechanisms: A survey In peer mechanisms, the competitors for a prize also determine who wins. Each competitor may be asked to rank, grade, or nominate peers for the prize. Since the prize can be valuable, such as financial aid, course grades, or an award at a conference, competitors may be tempted to manipulate the mechanism. We survey approaches to prevent or discourage the manipulation of peer mechanisms. We conclude our survey by identifying several important research challenges.",6
https://openalex.org/W4381550321,2023,A postulate-driven study of logical argumentation,"Logical argumentation is a well-known approach to modeling non-monotonic reasoning with conflicting information. In this paper we provide a comprehensive postulate-based study of properties of logical argumentation frameworks and a full characterization of their semantics and inference relations. In this way we identify well-behaved formal argumentative models of drawing logically justified inferences from a given set of possibly conflicting defeasible, as well as strict assumptions. Given some desiderata in terms of rationality postulates, we consider the conditions that an argumentation framework should fulfill for the desiderata to hold. One purpose of this approach is to assist designers to ""plug-in"" pre-defined formalisms according to actual needs. To this end, we present a classification of argumentation frameworks relative to the types of attacks they implement. In turn, for each class we determine which desiderata are satisfied. Our study is highly abstract, supposing only a minimal set of requirements on the considered underlying deductive systems, and in this way covering a broad range of formalisms, including classical, intuitionistic and modal logics.","A postulate-driven study of logical argumentation Logical argumentation is a well-known approach to modeling non-monotonic reasoning with conflicting information. In this paper we provide a comprehensive postulate-based study of properties of logical argumentation frameworks and a full characterization of their semantics and inference relations. In this way we identify well-behaved formal argumentative models of drawing logically justified inferences from a given set of possibly conflicting defeasible, as well as strict assumptions. Given some desiderata in terms of rationality postulates, we consider the conditions that an argumentation framework should fulfill for the desiderata to hold. One purpose of this approach is to assist designers to ""plug-in"" pre-defined formalisms according to actual needs. To this end, we present a classification of argumentation frameworks relative to the types of attacks they implement. In turn, for each class we determine which desiderata are satisfied. Our study is highly abstract, supposing only a minimal set of requirements on the considered underlying deductive systems, and in this way covering a broad range of formalisms, including classical, intuitionistic and modal logics.",5
https://openalex.org/W4401541997,2024,Modular control architecture for safe marine navigation: Reinforcement learning with predictive safety filters,,Modular control architecture for safe marine navigation: Reinforcement learning with predictive safety filters,5
https://openalex.org/W4402295390,2024,PathLAD+: Towards effective exact methods for subgraph isomorphism problem,,PathLAD+: Towards effective exact methods for subgraph isomorphism problem,5
https://openalex.org/W4388571844,2023,Sound and relatively complete belief Hoare logic for statistical hypothesis testing programs,"We propose a new approach to formally describing the requirement for statistical inference and checking whether a program uses the statistical method appropriately. Specifically, we define belief Hoare logic (BHL) for formalizing and reasoning about the statistical beliefs acquired via hypothesis testing. This program logic is sound and relatively complete with respect to a Kripke model for hypothesis tests. We demonstrate by examples that BHL is useful for reasoning about practical issues in hypothesis testing. In our framework, we clarify the importance of prior beliefs in acquiring statistical beliefs through hypothesis testing, and discuss the whole picture of the justification of statistical inference inside and outside the program logic.","Sound and relatively complete belief Hoare logic for statistical hypothesis testing programs We propose a new approach to formally describing the requirement for statistical inference and checking whether a program uses the statistical method appropriately. Specifically, we define belief Hoare logic (BHL) for formalizing and reasoning about the statistical beliefs acquired via hypothesis testing. This program logic is sound and relatively complete with respect to a Kripke model for hypothesis tests. We demonstrate by examples that BHL is useful for reasoning about practical issues in hypothesis testing. In our framework, we clarify the importance of prior beliefs in acquiring statistical beliefs through hypothesis testing, and discuss the whole picture of the justification of statistical inference inside and outside the program logic.",4
https://openalex.org/W4399388192,2024,A domain-independent agent architecture for adaptive operation in evolving open worlds,,A domain-independent agent architecture for adaptive operation in evolving open worlds,4
https://openalex.org/W4402023237,2024,Approximating problems in abstract argumentation with graph convolutional networks,,Approximating problems in abstract argumentation with graph convolutional networks,4
https://openalex.org/W4402739064,2024,Adaptive large-neighbourhood search for optimisation in answer-set programming,,Adaptive large-neighbourhood search for optimisation in answer-set programming,4
https://openalex.org/W4405987972,2025,CureGraph: Contrastive multi-modal graph representation learning for urban living circle health profiling and prediction,,CureGraph: Contrastive multi-modal graph representation learning for urban living circle health profiling and prediction,4
https://openalex.org/W4408106969,2025,ICCMA 2023: 5th International Competition on Computational Models of Argumentation,Publisher Copyright: © 2025 The Author(s),ICCMA 2023: 5th International Competition on Computational Models of Argumentation Publisher Copyright: © 2025 The Author(s),4
https://openalex.org/W4409921792,2025,Disjoint projected enumeration for SAT and SMT without blocking clauses,"All-Solution Satisfiability (AllSAT) and its extension, All-Solution Satisfiability Modulo Theories (AllSMT), have become more relevant in recent years, mainly in formal verification and artificial intelligence applications. The goal of these problems is the enumeration of all satisfying assignments of a formula (for SAT and SMT problems, respectively), making them useful for test generation, model checking, and probabilistic inference. Nevertheless, traditional AllSAT algorithms face significant computational challenges due to the exponential growth of the search space and inefficiencies caused by blocking clauses, which cause memory blowups and degrade unit propagation performance in the long term. This paper presents two novel solvers: TABULARALLSAT, a projected AllSAT solver, and TABULARALLSMT, a projected AllSMT solver. Both solvers combine Conflict-Driven Clause Learning (CDCL) with chronological backtracking to improve efficiency while ensuring disjoint enumeration. To retrieve compact partial assignments we propose a novel aggressive implicant shrinking algorithm, compatible with chronological backtracking, to minimize the number of partial assignments, reducing overall search complexity. Furthermore, we extend the solver framework to handle projected enumeration and SMT formulas effectively and efficiently, adapting the baseline framework to integrate theory reasoning and the distinction between important and non-important variables. An extensive experimental evaluation demonstrates the superiority of our approach compared to state-of-the-art solvers, particularly in scenarios requiring projection and SMT-based reasoning.","Disjoint projected enumeration for SAT and SMT without blocking clauses All-Solution Satisfiability (AllSAT) and its extension, All-Solution Satisfiability Modulo Theories (AllSMT), have become more relevant in recent years, mainly in formal verification and artificial intelligence applications. The goal of these problems is the enumeration of all satisfying assignments of a formula (for SAT and SMT problems, respectively), making them useful for test generation, model checking, and probabilistic inference. Nevertheless, traditional AllSAT algorithms face significant computational challenges due to the exponential growth of the search space and inefficiencies caused by blocking clauses, which cause memory blowups and degrade unit propagation performance in the long term. This paper presents two novel solvers: TABULARALLSAT, a projected AllSAT solver, and TABULARALLSMT, a projected AllSMT solver. Both solvers combine Conflict-Driven Clause Learning (CDCL) with chronological backtracking to improve efficiency while ensuring disjoint enumeration. To retrieve compact partial assignments we propose a novel aggressive implicant shrinking algorithm, compatible with chronological backtracking, to minimize the number of partial assignments, reducing overall search complexity. Furthermore, we extend the solver framework to handle projected enumeration and SMT formulas effectively and efficiently, adapting the baseline framework to integrate theory reasoning and the distinction between important and non-important variables. An extensive experimental evaluation demonstrates the superiority of our approach compared to state-of-the-art solvers, particularly in scenarios requiring projection and SMT-based reasoning.",4
https://openalex.org/W1789692117,2015,A new probabilistic constraint logic programming language based on a generalised distribution semantics,,A new probabilistic constraint logic programming language based on a generalised distribution semantics,18
https://openalex.org/W2268771889,2016,Broken triangles: From value merging to a tractable class of general-arity constraint satisfaction problems,,Broken triangles: From value merging to a tractable class of general-arity constraint satisfaction problems,18
