openalex_id,year,title,abstract,text,cited_by_count
https://openalex.org/W2907184427,2019,Maintenance of datalog materialisations revisited,"Datalog is a rule-based formalism that can axiomatise recursive properties such as reachability and transitive closure. Datalog implementations often materialise (i.e., precompute and store) all facts entailed by a datalog program and a set of explicit facts. Queries can thus be answered directly in the materialised facts, which is beneficial to the performance of query answering, but the materialised facts must be updated whenever the explicit facts change. Rematerialising all facts 'from scratch' can be very inefficient, so numerous materialisation maintenance algorithms have been developed that aim to efficiently identify the facts that require updating and thus reduce the overall work. Most such approaches are variants of the counting or Delete/Rederive (DRed) algorithms. Algorithms in the former group maintain additional data structures and are usually applicable only if datalog rules are not recursive, which limits their applicability in practice. Algorithms in the latter group do not require additional data structures and can handle recursive rules, but they can be inefficient when facts have multiple derivations. Finally, to the best of our knowledge, these approaches have not been compared and their practical applicability has not been investigated. Datalog is becoming increasingly important in practice, so a more comprehensive understanding of the tradeoffs between different approaches to materialisation maintenance is needed. In this paper we present three such algorithms for datalog with stratified negation: a new counting algorithm that can handle recursive rules, an optimised variant of the DRed algorithm that does not repeat derivations, and a new Forward/Backward/Forward (FBF) algorithm that extends DRed to better handle facts with multiple derivations. Furthermore, we study the worst-case performance of these algorithms and compare the algorithms' behaviour on several examples. Finally, we present the results of an extensive, first-of-a-kind empirical evaluation in which we investigate the robustness and the scaling behaviour of our algorithms. We thus provide important theoretical and practical insights into all three algorithms that will provide invaluable guidance to future implementors of datalog systems.","Maintenance of datalog materialisations revisited Datalog is a rule-based formalism that can axiomatise recursive properties such as reachability and transitive closure. Datalog implementations often materialise (i.e., precompute and store) all facts entailed by a datalog program and a set of explicit facts. Queries can thus be answered directly in the materialised facts, which is beneficial to the performance of query answering, but the materialised facts must be updated whenever the explicit facts change. Rematerialising all facts 'from scratch' can be very inefficient, so numerous materialisation maintenance algorithms have been developed that aim to efficiently identify the facts that require updating and thus reduce the overall work. Most such approaches are variants of the counting or Delete/Rederive (DRed) algorithms. Algorithms in the former group maintain additional data structures and are usually applicable only if datalog rules are not recursive, which limits their applicability in practice. Algorithms in the latter group do not require additional data structures and can handle recursive rules, but they can be inefficient when facts have multiple derivations. Finally, to the best of our knowledge, these approaches have not been compared and their practical applicability has not been investigated. Datalog is becoming increasingly important in practice, so a more comprehensive understanding of the tradeoffs between different approaches to materialisation maintenance is needed. In this paper we present three such algorithms for datalog with stratified negation: a new counting algorithm that can handle recursive rules, an optimised variant of the DRed algorithm that does not repeat derivations, and a new Forward/Backward/Forward (FBF) algorithm that extends DRed to better handle facts with multiple derivations. Furthermore, we study the worst-case performance of these algorithms and compare the algorithms' behaviour on several examples. Finally, we present the results of an extensive, first-of-a-kind empirical evaluation in which we investigate the robustness and the scaling behaviour of our algorithms. We thus provide important theoretical and practical insights into all three algorithms that will provide invaluable guidance to future implementors of datalog systems.",41
https://openalex.org/W3011623992,2020,Qualitative case-based reasoning and learning,,Qualitative case-based reasoning and learning,41
https://openalex.org/W2621108739,2017,WPM3: An (in)complete algorithm for weighted partial MaxSAT,,WPM3: An (in)complete algorithm for weighted partial MaxSAT,40
https://openalex.org/W3034364924,2020,Memetic algorithms outperform evolutionary algorithms in multimodal optimisation,,Memetic algorithms outperform evolutionary algorithms in multimodal optimisation,40
https://openalex.org/W2895357514,2019,The algorithm selection competitions 2015 and 2017,,The algorithm selection competitions 2015 and 2017,39
https://openalex.org/W3206015054,2021,Evaluation of argument strength in attack graphs: Foundations and semantics,"An argumentation framework is a pair made of a graph and a semantics. The nodes and the edges of the graph represent respectively arguments and relations (e.g., attacks, supports) between arguments while the semantics evaluates the strength of each argument of the graph. This paper investigates gradual semantics dealing with weighted graphs, a family of graphs where each argument has an initial weight and may be attacked by other arguments. It contains four contributions. The first consists of laying the foundations of gradual semantics by proposing key principles on which evaluation of argument strength may be based. Foundations are important not only for a better understanding of the evaluation process in general, but also for clarifying the basic assumptions underlying semantics, for comparing different (families of) semantics, and for identifying families of semantics that have not been explored yet. The second contribution consists of providing a formal analysis and a comprehensive comparison of the semantics that have been defined in the literature for evaluating arguments in weighted graphs. As a third contribution, the paper proposes three novel semantics and shows which principles they satisfy. The last contribution is the implementation and empirical evaluation of the three novel semantics. We show that the three semantics are very efficient in that they compute the strengths of arguments in less than 20 iterations and in a very short time. This holds even for very large graphs, meaning that the three semantics scale very well.","Evaluation of argument strength in attack graphs: Foundations and semantics An argumentation framework is a pair made of a graph and a semantics. The nodes and the edges of the graph represent respectively arguments and relations (e.g., attacks, supports) between arguments while the semantics evaluates the strength of each argument of the graph. This paper investigates gradual semantics dealing with weighted graphs, a family of graphs where each argument has an initial weight and may be attacked by other arguments. It contains four contributions. The first consists of laying the foundations of gradual semantics by proposing key principles on which evaluation of argument strength may be based. Foundations are important not only for a better understanding of the evaluation process in general, but also for clarifying the basic assumptions underlying semantics, for comparing different (families of) semantics, and for identifying families of semantics that have not been explored yet. The second contribution consists of providing a formal analysis and a comprehensive comparison of the semantics that have been defined in the literature for evaluating arguments in weighted graphs. As a third contribution, the paper proposes three novel semantics and shows which principles they satisfy. The last contribution is the implementation and empirical evaluation of the three novel semantics. We show that the three semantics are very efficient in that they compute the strengths of arguments in less than 20 iterations and in a very short time. This holds even for very large graphs, meaning that the three semantics scale very well.",39
https://openalex.org/W2201560525,2015,Characteristic function games with restricted agent interactions: Core-stability and coalition structures,,Characteristic function games with restricted agent interactions: Core-stability and coalition structures,38
https://openalex.org/W2639976559,2017,Understanding the complexity of axiom pinpointing in lightweight description logics,,Understanding the complexity of axiom pinpointing in lightweight description logics,38
https://openalex.org/W2999635570,2020,Synchronous bidirectional inference for neural sequence generation,,Synchronous bidirectional inference for neural sequence generation,38
https://openalex.org/W2484319280,2016,New local search methods for partial MaxSAT,,New local search methods for partial MaxSAT,37
https://openalex.org/W2971452554,2019,Exploiting reverse target-side contexts for neural machine translation via asynchronous bidirectional decoding,,Exploiting reverse target-side contexts for neural machine translation via asynchronous bidirectional decoding,37
https://openalex.org/W2762242067,2017,Overlapping layered learning,,Overlapping layered learning,36
https://openalex.org/W2269865230,2016,MaxSAT by improved instance-specific algorithm configuration,,MaxSAT by improved instance-specific algorithm configuration,35
https://openalex.org/W2916924555,2020,Negotiating team formation using deep reinforcement learning,,Negotiating team formation using deep reinforcement learning,35
https://openalex.org/W2949380671,2019,Optimizing group learning: An evolutionary computing approach,,Optimizing group learning: An evolutionary computing approach,35
https://openalex.org/W2963963281,2019,Automatic generation of sentimental texts via mixture adversarial networks,,Automatic generation of sentimental texts via mixture adversarial networks,35
https://openalex.org/W3005593316,2020,Robust learning with imperfect privileged information,,Robust learning with imperfect privileged information,35
https://openalex.org/W2090857454,2015,Computer-aided proof of Erdős discrepancy properties,,Computer-aided proof of Erdős discrepancy properties,34
https://openalex.org/W2409909788,2016,Generating SAT instances with community structure,"Nowadays, modern SAT solvers are able to efficiently solve many industrial, or real-world, SAT instances. However, the process of development and testing of new SAT solving techniques is conditioned to the finite and reduced number of known industrial benchmarks. Therefore, new models of random SAT instances generation that capture realistically the features of real-world problems can be beneficial to the SAT community. In many works, the structure of industrial instances has been analyzed representing them as graphs and studying some of their properties, like modularity. In this work, we use the notion of modularity to define a new model of generation of random SAT instances with community structure, called Community Attachment. For high values of modularity (i.e., clear community structure), we realistically model pseudo-industrial random SAT formulas. This model also generates SAT instances very similar to classical random formulas using a low value of modularity. We also prove that the phase transition point, if exists, is independent on the modularity. We evaluate the adequacy of this model to real industrial SAT problems in terms of SAT solvers performance, and show that modern solvers do actually exploit this community structure. Finally, we use this generator to observe the connections between the modularity of the instance and some components of the solver, such as the variable branching heuristics or the clause learning mechanism.","Generating SAT instances with community structure Nowadays, modern SAT solvers are able to efficiently solve many industrial, or real-world, SAT instances. However, the process of development and testing of new SAT solving techniques is conditioned to the finite and reduced number of known industrial benchmarks. Therefore, new models of random SAT instances generation that capture realistically the features of real-world problems can be beneficial to the SAT community. In many works, the structure of industrial instances has been analyzed representing them as graphs and studying some of their properties, like modularity. In this work, we use the notion of modularity to define a new model of generation of random SAT instances with community structure, called Community Attachment. For high values of modularity (i.e., clear community structure), we realistically model pseudo-industrial random SAT formulas. This model also generates SAT instances very similar to classical random formulas using a low value of modularity. We also prove that the phase transition point, if exists, is independent on the modularity. We evaluate the adequacy of this model to real industrial SAT problems in terms of SAT solvers performance, and show that modern solvers do actually exploit this community structure. Finally, we use this generator to observe the connections between the modularity of the instance and some components of the solver, such as the variable branching heuristics or the clause learning mechanism.",34
https://openalex.org/W986845748,2015,Revision in networks of ontologies,,Revision in networks of ontologies,34
https://openalex.org/W2299136288,2016,Truncated incremental search,,Truncated incremental search,33
https://openalex.org/W2301736536,2016,Semi-equilibrium models for paracoherent answer set programs,,Semi-equilibrium models for paracoherent answer set programs,33
https://openalex.org/W2398436144,2016,Automatic construction of parallel portfolios via algorithm configuration,,Automatic construction of parallel portfolios via algorithm configuration,33
https://openalex.org/W2933386281,2019,Attachment centrality: Measure for connectivity in networks,,Attachment centrality: Measure for connectivity in networks,33
https://openalex.org/W1440788545,2015,Cost-optimal constrained correlation clustering via weighted partial Maximum Satisfiability,,Cost-optimal constrained correlation clustering via weighted partial Maximum Satisfiability,32
https://openalex.org/W1764902476,2015,MiningZinc: A declarative framework for constraint-based mining,,MiningZinc: A declarative framework for constraint-based mining,32
https://openalex.org/W1993695231,2015,On redundant topological constraints,,On redundant topological constraints,32
https://openalex.org/W2952411634,2019,Democratic fair allocation of indivisible goods,,Democratic fair allocation of indivisible goods,32
https://openalex.org/W4200044613,2021,Imperfect ImaGANation: Implications of GANs exacerbating biases on facial data augmentation and snapchat face lenses,,Imperfect ImaGANation: Implications of GANs exacerbating biases on facial data augmentation and snapchat face lenses,32
https://openalex.org/W4309023041,2022,"<mml:math xmlns:mml=""http://www.w3.org/1998/Math/MathML"" altimg=""si1.svg""><mml:mi mathvariant=""script"">G</mml:mi></mml:math>-LIME: Statistical learning for local interpretations of deep neural networks using global priors",,"<mml:math xmlns:mml=""http://www.w3.org/1998/Math/MathML"" altimg=""si1.svg""><mml:mi mathvariant=""script"">G</mml:mi></mml:math>-LIME: Statistical learning for local interpretations of deep neural networks using global priors",32
https://openalex.org/W2047865008,2015,Grounded fixpoints and their applications in knowledge representation,,Grounded fixpoints and their applications in knowledge representation,31
https://openalex.org/W2321956722,2016,"POPPONENT: Highly accurate, individually and socially efficient opponent preference model in bilateral multi issue negotiations",,"POPPONENT: Highly accurate, individually and socially efficient opponent preference model in bilateral multi issue negotiations",31
https://openalex.org/W2581044847,2017,Model-lite planning: Case-based vs. model-based approaches,,Model-lite planning: Case-based vs. model-based approaches,31
https://openalex.org/W2605370823,2017,"On the logical properties of the nonmonotonic description logic <mml:math xmlns:mml=""http://www.w3.org/1998/Math/MathML"" altimg=""si1.gif"" overflow=""scroll""><mml:msup><mml:mrow><mml:mi mathvariant=""script"">DL</mml:mi></mml:mrow><mml:mrow><mml:mi mathvariant=""normal"">N</mml:mi></mml:mrow></mml:msup></mml:math>","DLN is a recent nonmonotonic description logic, designed for satisfying independently proposed knowledge engineering requirements, and for removing some recurrent drawbacks of traditional nonmonotonic semantics. In this paper we study the logical properties of DLN and illustrate some of the relationships between the KLM postulates and the characteristic features of DLN, including its novel way of dealing with unresolved conflicts between defeasible axioms. Moreover, we fix a problem affecting the original semantics of DLN and accordingly adapt the reduction from DLN inferences to classical inferences. Along the paper, we use various versions of the KLM postulates to deepen the comparison with related work, and illustrate the different tradeoffs between opposite requirements adopted by each approach.","On the logical properties of the nonmonotonic description logic <mml:math xmlns:mml=""http://www.w3.org/1998/Math/MathML"" altimg=""si1.gif"" overflow=""scroll""><mml:msup><mml:mrow><mml:mi mathvariant=""script"">DL</mml:mi></mml:mrow><mml:mrow><mml:mi mathvariant=""normal"">N</mml:mi></mml:mrow></mml:msup></mml:math> DLN is a recent nonmonotonic description logic, designed for satisfying independently proposed knowledge engineering requirements, and for removing some recurrent drawbacks of traditional nonmonotonic semantics. In this paper we study the logical properties of DLN and illustrate some of the relationships between the KLM postulates and the characteristic features of DLN, including its novel way of dealing with unresolved conflicts between defeasible axioms. Moreover, we fix a problem affecting the original semantics of DLN and accordingly adapt the reduction from DLN inferences to classical inferences. Along the paper, we use various versions of the KLM postulates to deepen the comparison with related work, and illustrate the different tradeoffs between opposite requirements adopted by each approach.",31
https://openalex.org/W2790098524,2019,Separators and adjustment sets in causal graphs: Complete criteria and an algorithmic framework,,Separators and adjustment sets in causal graphs: Complete criteria and an algorithmic framework,31
