openalex_id,year,title,abstract,text,cited_by_count
https://openalex.org/W3131457744,2021,What do we want from Explainable Artificial Intelligence (XAI)? – A stakeholder perspective on XAI and a conceptual model guiding interdisciplinary XAI research,,What do we want from Explainable Artificial Intelligence (XAI)? – A stakeholder perspective on XAI and a conceptual model guiding interdisciplinary XAI research,527
https://openalex.org/W2964319113,2018,Predicting citywide crowd flows using deep spatio-temporal residual networks,,Predicting citywide crowd flows using deep spatio-temporal residual networks,503
https://openalex.org/W2670253439,2018,Explanation in artificial intelligence: Insights from the social sciences,,Explanation in artificial intelligence: Insights from the social sciences,487
https://openalex.org/W2758442112,2018,Autonomous agents modelling other agents: A comprehensive survey and open problems,,Autonomous agents modelling other agents: A comprehensive survey and open problems,399
https://openalex.org/W2482333547,2016,Artificial cognition for social human–robot interaction: An implementation,"Human–Robot Interaction challenges Artificial Intelligence in many regards: dynamic, partially unknown environments that were not originally designed for robots; a broad variety of situations with rich semantics to understand and interpret; physical interactions with humans that requires fine, low-latency yet socially acceptable control strategies; natural and multi-modal communication which mandates common-sense knowledge and the representation of possibly divergent mental models. This article is an attempt to characterise these challenges and to exhibit a set of key decisional issues that need to be addressed for a cognitive robot to successfully share space and tasks with a human.\n\nWe identify first the needed individual and collaborative cognitive skills: geometric reasoning and situation assessment based on perspective-taking and affordance analysis; acquisition and representation of knowledge models for multiple agents (humans and robots, with their specificities); situated, natural and multi-modal dialogue; human-aware task planning; human–robot joint task achievement. The article discusses each of these abilities, presents working implementations, and shows how they combine in a coherent and original deliberative architecture for human–robot interaction. Supported by experimental results, we eventually show how explicit knowledge management, both symbolic and geometric, proves to be instrumental to richer and more natural human–robot interactions by pushing for pervasive, human-level semantics within the robot's deliberative system.","Artificial cognition for social human–robot interaction: An implementation Human–Robot Interaction challenges Artificial Intelligence in many regards: dynamic, partially unknown environments that were not originally designed for robots; a broad variety of situations with rich semantics to understand and interpret; physical interactions with humans that requires fine, low-latency yet socially acceptable control strategies; natural and multi-modal communication which mandates common-sense knowledge and the representation of possibly divergent mental models. This article is an attempt to characterise these challenges and to exhibit a set of key decisional issues that need to be addressed for a cognitive robot to successfully share space and tasks with a human.\n\nWe identify first the needed individual and collaborative cognitive skills: geometric reasoning and situation assessment based on perspective-taking and affordance analysis; acquisition and representation of knowledge models for multiple agents (humans and robots, with their specificities); situated, natural and multi-modal dialogue; human-aware task planning; human–robot joint task achievement. The article discusses each of these abilities, presents working implementations, and shows how they combine in a coherent and original deliberative architecture for human–robot interaction. Supported by experimental results, we eventually show how explicit knowledge management, both symbolic and geometric, proves to be instrumental to richer and more natural human–robot interactions by pushing for pervasive, human-level semantics within the robot's deliberative system.",373
https://openalex.org/W3164005523,2021,Reward is enough,"In this article we hypothesise that intelligence, and its associated abilities, can be understood as subserving the maximisation of reward. Accordingly, reward is enough to drive behaviour that exhibits abilities studied in natural and artificial intelligence, including knowledge, learning, perception, social intelligence, language, generalisation and imitation. This is in contrast to the view that specialised problem formulations are needed for each ability, based on other signals or objectives. Furthermore, we suggest that agents that learn through trial and error experience to maximise reward could learn behaviour that exhibits most if not all of these abilities, and therefore that powerful reinforcement learning agents could constitute a solution to artificial general intelligence.","Reward is enough In this article we hypothesise that intelligence, and its associated abilities, can be understood as subserving the maximisation of reward. Accordingly, reward is enough to drive behaviour that exhibits abilities studied in natural and artificial intelligence, including knowledge, learning, perception, social intelligence, language, generalisation and imitation. This is in contrast to the view that specialised problem formulations are needed for each ability, based on other signals or objectives. Furthermore, we suggest that agents that learn through trial and error experience to maximise reward could learn behaviour that exhibits most if not all of these abilities, and therefore that powerful reinforcement learning agents could constitute a solution to artificial general intelligence.",371
https://openalex.org/W3095444354,2020,Evaluating XAI: A comparison of rule-based and example-based explanations,"&lt;p&gt;Current developments in Artificial Intelligence (AI) led to a resurgence of Explainable AI (XAI). New methods are being researched to obtain information from AI systems in order to generate explanations for their output. However, there is an overall lack of valid and reliable evaluations of the effects on users' experience of, and behavior in response to explanations. New XAI methods are often based on an intuitive notion what an effective explanation should be. Rule- and example-based contrastive explanations are two exemplary explanation styles. In this study we evaluate the effects of these two explanation styles on system understanding, persuasive power and task performance in the context of decision support in diabetes self-management. Furthermore, we provide three sets of recommendations based on our experience designing this evaluation to help improve future evaluations. Our results show that rule-based explanations have a small positive effect on system understanding, whereas both rule- and example-based explanations seem to persuade users in following the advice even when incorrect. Neither explanation improves task performance compared to no explanation. This can be explained by the fact that both explanation styles only provide details relevant for a single decision, not the underlying rational or causality. These results show the importance of user evaluations in assessing the current assumptions and intuitions on effective explanations.&lt;/p&gt;","Evaluating XAI: A comparison of rule-based and example-based explanations &lt;p&gt;Current developments in Artificial Intelligence (AI) led to a resurgence of Explainable AI (XAI). New methods are being researched to obtain information from AI systems in order to generate explanations for their output. However, there is an overall lack of valid and reliable evaluations of the effects on users' experience of, and behavior in response to explanations. New XAI methods are often based on an intuitive notion what an effective explanation should be. Rule- and example-based contrastive explanations are two exemplary explanation styles. In this study we evaluate the effects of these two explanation styles on system understanding, persuasive power and task performance in the context of decision support in diabetes self-management. Furthermore, we provide three sets of recommendations based on our experience designing this evaluation to help improve future evaluations. Our results show that rule-based explanations have a small positive effect on system understanding, whereas both rule- and example-based explanations seem to persuade users in following the advice even when incorrect. Neither explanation improves task performance compared to no explanation. This can be explained by the fact that both explanation styles only provide details relevant for a single decision, not the underlying rational or causality. These results show the importance of user evaluations in assessing the current assumptions and intuitions on effective explanations.&lt;/p&gt;",339
https://openalex.org/W3210179814,2021,Knowledge graphs as tools for explainable machine learning: A survey,"This paper provides an extensive overview of the use of knowledge graphs in the context of Explainable Machine Learning. As of late, explainable AI has become a very active field of research by addressing the limitations of the latest machine learning solutions that often provide highly accurate, but hardly scrutable and interpretable decisions. An increasing interest has also been shown in the integration of Knowledge Representation techniques in Machine Learning applications, mostly motivated by the complementary strengths and weaknesses that could lead to a new generation of hybrid intelligent systems. Following this idea, we hypothesise that knowledge graphs, which naturally provide domain background knowledge in a machine-readable format, could be integrated in Explainable Machine Learning approaches to help them provide more meaningful, insightful and trustworthy explanations. Using a systematic literature review methodology we designed an analytical framework to explore the current landscape of Explainable Machine Learning. We focus particularly on the integration with structured knowledge at large scale, and use our framework to analyse a variety of Machine Learning domains, identifying the main characteristics of such knowledge-based, explainable systems from different perspectives. We then summarise the strengths of such hybrid systems, such as improved understandability, reactivity, and accuracy, as well as their limitations, e.g. in handling noise or extracting knowledge efficiently. We conclude by discussing a list of open challenges left for future research.","Knowledge graphs as tools for explainable machine learning: A survey This paper provides an extensive overview of the use of knowledge graphs in the context of Explainable Machine Learning. As of late, explainable AI has become a very active field of research by addressing the limitations of the latest machine learning solutions that often provide highly accurate, but hardly scrutable and interpretable decisions. An increasing interest has also been shown in the integration of Knowledge Representation techniques in Machine Learning applications, mostly motivated by the complementary strengths and weaknesses that could lead to a new generation of hybrid intelligent systems. Following this idea, we hypothesise that knowledge graphs, which naturally provide domain background knowledge in a machine-readable format, could be integrated in Explainable Machine Learning approaches to help them provide more meaningful, insightful and trustworthy explanations. Using a systematic literature review methodology we designed an analytical framework to explore the current landscape of Explainable Machine Learning. We focus particularly on the integration with structured knowledge at large scale, and use our framework to analyse a variety of Machine Learning domains, identifying the main characteristics of such knowledge-based, explainable systems from different perspectives. We then summarise the strengths of such hybrid systems, such as improved understandability, reactivity, and accuracy, as well as their limitations, e.g. in handling noise or extracting knowledge efficiently. We conclude by discussing a list of open challenges left for future research.",255
https://openalex.org/W2295615964,2020,Multiple object tracking: A literature review,,Multiple object tracking: A literature review,247
https://openalex.org/W760913798,2015,Bi-goal evolution for many-objective optimization problems,"This paper presents a meta-objective optimization approach, called Bi-Goal Evolution (BiGE), to deal with multi-objective optimization problems with many objectives. In multi-objective optimization, it is generally observed that 1) the conflict between the proximity and diversity requirements is aggravated with the increase of the number of objectives and 2) the Pareto dominance loses its effectiveness for a high-dimensional space but works well on a low-dimensional space. Inspired by these two observations, BiGE converts a given multi-objective optimization problem into a bi-goal (objective) optimization problem regarding proximity and diversity, and then handles it using the Pareto dominance relation in this bi-goal domain. Implemented with estimation methods of individuals' performance and the classic Pareto nondominated sorting procedure, BiGE divides individuals into different nondominated layers and attempts to put well-converged and well-distributed individuals into the first few layers. From a series of extensive experiments on four groups of well-defined continuous and combinatorial optimization problems with 5, 10 and 15 objectives, BiGE has been found to be very competitive against five state-of-the-art algorithms in balancing proximity and diversity. The proposed approach is the first step towards a new way of addressing many-objective problems as well as indicating several important issues for future development of this type of algorithms.","Bi-goal evolution for many-objective optimization problems This paper presents a meta-objective optimization approach, called Bi-Goal Evolution (BiGE), to deal with multi-objective optimization problems with many objectives. In multi-objective optimization, it is generally observed that 1) the conflict between the proximity and diversity requirements is aggravated with the increase of the number of objectives and 2) the Pareto dominance loses its effectiveness for a high-dimensional space but works well on a low-dimensional space. Inspired by these two observations, BiGE converts a given multi-objective optimization problem into a bi-goal (objective) optimization problem regarding proximity and diversity, and then handles it using the Pareto dominance relation in this bi-goal domain. Implemented with estimation methods of individuals' performance and the classic Pareto nondominated sorting procedure, BiGE divides individuals into different nondominated layers and attempts to put well-converged and well-distributed individuals into the first few layers. From a series of extensive experiments on four groups of well-defined continuous and combinatorial optimization problems with 5, 10 and 15 objectives, BiGE has been found to be very competitive against five state-of-the-art algorithms in balancing proximity and diversity. The proposed approach is the first step towards a new way of addressing many-objective problems as well as indicating several important issues for future development of this type of algorithms.",233
https://openalex.org/W2913781869,2019,The Hanabi challenge: A new frontier for AI research,,The Hanabi challenge: A new frontier for AI research,231
https://openalex.org/W4213228517,2022,Relation between prognostics predictor evaluation metrics and local interpretability SHAP values,"&lt;p&gt;Maintenance decisions in domains such as aeronautics are becoming increasingly dependent on being able to predict the failure of components and systems. When data-driven techniques are used for this prognostic task, they often face headwinds due to their perceived lack of interpretability. To address this issue, this paper examines how features used in a data-driven prognostic approach correlate with established metrics of monotonicity, trendability, and prognosability. In particular, we use the SHAP model (SHapley Additive exPlanations) from the field of eXplainable Artificial Intelligence (XAI) to analyze the outcome of three increasingly complex algorithms: Linear Regression, Multi-Layer Perceptron, and Echo State Network. Our goal is to test the hypothesis that the prognostics metrics correlate with the SHAP model's explanations, i.e., the SHAP values. We use baseline data from a standard data set that contains several hundred run-to-failure trajectories for jet engines. The results indicate that SHAP values track very closely with these metrics with differences observed between the models that support the assertion that model complexity is a significant factor to consider when explainability is a consideration in prognostics.&lt;/p&gt;","Relation between prognostics predictor evaluation metrics and local interpretability SHAP values &lt;p&gt;Maintenance decisions in domains such as aeronautics are becoming increasingly dependent on being able to predict the failure of components and systems. When data-driven techniques are used for this prognostic task, they often face headwinds due to their perceived lack of interpretability. To address this issue, this paper examines how features used in a data-driven prognostic approach correlate with established metrics of monotonicity, trendability, and prognosability. In particular, we use the SHAP model (SHapley Additive exPlanations) from the field of eXplainable Artificial Intelligence (XAI) to analyze the outcome of three increasingly complex algorithms: Linear Regression, Multi-Layer Perceptron, and Echo State Network. Our goal is to test the hypothesis that the prognostics metrics correlate with the SHAP model's explanations, i.e., the SHAP values. We use baseline data from a standard data set that contains several hundred run-to-failure trajectories for jet engines. The results indicate that SHAP values track very closely with these metrics with differences observed between the models that support the assertion that model complexity is a significant factor to consider when explainability is a consideration in prognostics.&lt;/p&gt;",227
https://openalex.org/W1471542436,2016,ASlib: A benchmark library for algorithm selection,,ASlib: A benchmark library for algorithm selection,207
https://openalex.org/W2517456239,2016,Nasari: Integrating explicit knowledge and corpus statistics for a multilingual representation of concepts and entities,,Nasari: Integrating explicit knowledge and corpus statistics for a multilingual representation of concepts and entities,194
https://openalex.org/W3121787084,2021,Explaining black-box classifiers using post-hoc explanations-by-example: The effect of explanations and error-rates in XAI user studies,"In this paper, we describe a post-hoc explanation-by-example approach to eXplainable AI (XAI), where a black-box, deep learning system is explained by reference to a more transparent, proxy model (in this situation a case-based reasoner), based on a feature-weighting analysis of the former that is used to find explanatory cases from the latter (as one instance of the so-called Twin Systems approach). A novel method (COLE-HP) for extracting the feature-weights from black-box models is demonstrated for a convolutional neural network (CNN) applied to the MNIST dataset; in which extracted feature-weights are used to find explanatory, nearest-neighbours for test instances. Three user studies are reported examining people's judgements of right and wrong classifications made by this XAI twin-system, in the presence/absence of explanations-by-example and different error-rates (from 3-60%). The judgements gathered include item-level evaluations of both correctness and reasonableness, and system-level evaluations of trust, satisfaction, correctness, and reasonableness. Several proposals are made about the user's mental model in these tasks and how it is impacted by explanations at an item- and system-level. The wider lessons from this work for XAI and its user studies are reviewed.","Explaining black-box classifiers using post-hoc explanations-by-example: The effect of explanations and error-rates in XAI user studies In this paper, we describe a post-hoc explanation-by-example approach to eXplainable AI (XAI), where a black-box, deep learning system is explained by reference to a more transparent, proxy model (in this situation a case-based reasoner), based on a feature-weighting analysis of the former that is used to find explanatory cases from the latter (as one instance of the so-called Twin Systems approach). A novel method (COLE-HP) for extracting the feature-weights from black-box models is demonstrated for a convolutional neural network (CNN) applied to the MNIST dataset; in which extracted feature-weights are used to find explanatory, nearest-neighbours for test instances. Three user studies are reported examining people's judgements of right and wrong classifications made by this XAI twin-system, in the presence/absence of explanations-by-example and different error-rates (from 3-60%). The judgements gathered include item-level evaluations of both correctness and reasonableness, and system-level evaluations of trust, satisfaction, correctness, and reasonableness. Several proposals are made about the user's mental model in these tasks and how it is impacted by explanations at an item- and system-level. The wider lessons from this work for XAI and its user studies are reviewed.",190
https://openalex.org/W2603920273,2017,Towards a science of integrated AI and Robotics,,Towards a science of integrated AI and Robotics,176
https://openalex.org/W1645067740,2015,Coalition structure generation: A survey,,Coalition structure generation: A survey,169
https://openalex.org/W1791197240,2015,Representations for robot knowledge in the KnowRob framework,,Representations for robot knowledge in the KnowRob framework,161
https://openalex.org/W2201744460,2015,Semantic-based regularization for learning and inference,,Semantic-based regularization for learning and inference,154
https://openalex.org/W3086560451,2020,"Explanation in AI and law: Past, present and future",,"Explanation in AI and law: Past, present and future",152
https://openalex.org/W2987375645,2019,"Mind the gaps: Assuring the safety of autonomous systems from an engineering, ethical, and legal perspective",,"Mind the gaps: Assuring the safety of autonomous systems from an engineering, ethical, and legal perspective",149
https://openalex.org/W1981696983,2015,Integer Linear Programming for the Bayesian network structure learning problem,,Integer Linear Programming for the Bayesian network structure learning problem,147
https://openalex.org/W2149280200,2015,Robot task planning and explanation in open and uncertain worlds,,Robot task planning and explanation in open and uncertain worlds,147
https://openalex.org/W1995236272,2015,Moving average reversion strategy for on-line portfolio selection,,Moving average reversion strategy for on-line portfolio selection,145
https://openalex.org/W2144244034,2015,Optimizing ontology alignments through a Memetic Algorithm using both MatchFmeasure and Unanimous Improvement Ratio,,Optimizing ontology alignments through a Memetic Algorithm using both MatchFmeasure and Unanimous Improvement Ratio,137
https://openalex.org/W229642387,2015,Semantic characterization of rational closure: From propositional logic to description logics,,Semantic characterization of rational closure: From propositional logic to description logics,137
https://openalex.org/W2295870642,2015,Optimal social choice functions: A utilitarian view,,Optimal social choice functions: A utilitarian view,135
https://openalex.org/W2340952989,2015,Law and logic: A review from an argumentation perspective,,Law and logic: A review from an argumentation perspective,135
https://openalex.org/W2124032835,2015,Transferring skills to humanoid robots by extracting semantic representations from observations of human activities,,Transferring skills to humanoid robots by extracting semantic representations from observations of human activities,130
https://openalex.org/W2923915248,2021,Explaining individual predictions when features are dependent: More accurate approximations to Shapley values,,Explaining individual predictions when features are dependent: More accurate approximations to Shapley values,130
https://openalex.org/W3121562452,2021,GLocalX - From Local to Global Explanations of Black Box AI Models,,GLocalX - From Local to Global Explanations of Black Box AI Models,124
