openalex_id,year,title,abstract,text,cited_by_count
https://openalex.org/W2949262682,2019,Protecting Elections by Recounting Ballots,"Complexity of voting manipulation is a prominent topic in computational social choice. In this work, we consider a two-stage voting manipulation scenario. First, a malicious party (an attacker) attempts to manipulate the election outcome in favor of a preferred candidate by changing the vote counts in some of the voting districts. Afterwards, another party (a defender), which cares about the voters' wishes, demands a recount in a subset of the manipulated districts, restoring their vote counts to their original values. We investigate the resulting Stackelberg game for the case where votes are aggregated using two variants of the Plurality rule, and obtain an almost complete picture of the complexity landscape, both from the attacker's and from the defender's perspective.","Protecting Elections by Recounting Ballots Complexity of voting manipulation is a prominent topic in computational social choice. In this work, we consider a two-stage voting manipulation scenario. First, a malicious party (an attacker) attempts to manipulate the election outcome in favor of a preferred candidate by changing the vote counts in some of the voting districts. Afterwards, another party (a defender), which cares about the voters' wishes, demands a recount in a subset of the manipulated districts, restoring their vote counts to their original values. We investigate the resulting Stackelberg game for the case where votes are aggregated using two variants of the Plurality rule, and obtain an almost complete picture of the complexity landscape, both from the attacker's and from the defender's perspective.",2
https://openalex.org/W2967673938,2019,A set of new multi- and many-objective test problems for continuous optimization and a comprehensive experimental evaluation,,A set of new multi- and many-objective test problems for continuous optimization and a comprehensive experimental evaluation,2
https://openalex.org/W3180638810,2022,Certifiably robust interpretation via Rényi differential privacy,,Certifiably robust interpretation via Rényi differential privacy,2
https://openalex.org/W3213548631,2021,Bayesian auctions with efficient queries,,Bayesian auctions with efficient queries,2
https://openalex.org/W4283806468,2022,Graph-based construction of minimal models,,Graph-based construction of minimal models,2
https://openalex.org/W4308382757,2022,"Fair and efficient allocation with few agent types, few item types, or small value levels",,"Fair and efficient allocation with few agent types, few item types, or small value levels",2
https://openalex.org/W4319991585,2023,Risk-aware analysis for interpretations of probabilistic achievement and maintenance commitments,,Risk-aware analysis for interpretations of probabilistic achievement and maintenance commitments,2
https://openalex.org/W4321793649,2023,Taking into account “who said what” in abstract argumentation: Complexity results,"We propose a new paradigm for reasoning over abstract argumentation frameworks where the ""who said what"" relation, associating each argument with the set of agents who claimed it, is taken into account, along with possible information on the trustworthiness of the agents. Specifically, we extend the traditional reasoning based on the classical verification and acceptance problems and introduce a reasoning paradigm investigating how the ""robustness"" of a set of arguments S (in terms of being an extension or not) or of an argument a (in terms of being accepted or not) can change if what has been claimed by some agents is ignored (as if these agents were removed from the dispute modeled by the argumentation framework). In this regard, we address the problems of searching the ""minimum extent"" of the removal of agents that makes a set S an extension or an argument a accepted. Compared with the case where only the ""yes/no"" answer of the traditional verification and acceptance problems are available, the knowledge of such a minimum provides the analyst with further insights allowing them to better judge the robustness of S and a. We consider the above minimization problems in two variants, where the agents are associated with a measure of their trustworthiness or not and provide a thorough characterization of their complexities.","Taking into account “who said what” in abstract argumentation: Complexity results We propose a new paradigm for reasoning over abstract argumentation frameworks where the ""who said what"" relation, associating each argument with the set of agents who claimed it, is taken into account, along with possible information on the trustworthiness of the agents. Specifically, we extend the traditional reasoning based on the classical verification and acceptance problems and introduce a reasoning paradigm investigating how the ""robustness"" of a set of arguments S (in terms of being an extension or not) or of an argument a (in terms of being accepted or not) can change if what has been claimed by some agents is ignored (as if these agents were removed from the dispute modeled by the argumentation framework). In this regard, we address the problems of searching the ""minimum extent"" of the removal of agents that makes a set S an extension or an argument a accepted. Compared with the case where only the ""yes/no"" answer of the traditional verification and acceptance problems are available, the knowledge of such a minimum provides the analyst with further insights allowing them to better judge the robustness of S and a. We consider the above minimization problems in two variants, where the agents are associated with a measure of their trustworthiness or not and provide a thorough characterization of their complexities.",2
https://openalex.org/W4391994451,2024,Finding the optimal exploration-exploitation trade-off online through Bayesian risk estimation and minimization,,Finding the optimal exploration-exploitation trade-off online through Bayesian risk estimation and minimization,2
https://openalex.org/W4392562957,2024,“Guess what I'm doing”: Extending legibility to sequential decision tasks,,“Guess what I'm doing”: Extending legibility to sequential decision tasks,2
https://openalex.org/W4392615967,2024,Non-deterministic approximation fixpoint theory and its application in disjunctive logic programming,,Non-deterministic approximation fixpoint theory and its application in disjunctive logic programming,2
https://openalex.org/W4398249948,2024,Joint learning of reward machines and policies in environments with partially known semantics,,Joint learning of reward machines and policies in environments with partially known semantics,2
https://openalex.org/W4401241490,2024,NovPhy: A physical reasoning benchmark for open-world AI systems,"Due to the emergence of AI systems that interact with the physical environment, there is an increased interest in incorporating physical reasoning capabilities into those AI systems. But is it enough to only have physical reasoning capabilities to operate in a real physical environment? In the real world, we constantly face novel situations we have not encountered before. As humans, we are competent at successfully adapting to those situations. Similarly, an agent needs to have the ability to function under the impact of novelties in order to properly operate in an open-world physical environment. To facilitate the development of such AI systems, we propose a new benchmark, NovPhy, that requires an agent to reason about physical scenarios in the presence of novelties and take actions accordingly. The benchmark consists of tasks that require agents to detect and adapt to novelties in physical scenarios. To create tasks in the benchmark, we develop eight novelties representing a diverse novelty space and apply them to five commonly encountered scenarios in a physical environment, related to applying forces and motions such as rolling, falling, and sliding of objects. According to our benchmark design, we evaluate two capabilities of an agent: the performance on a novelty when it is applied to different physical scenarios and the performance on a physical scenario when different novelties are applied to it. We conduct a thorough evaluation with human players, learning agents, and heuristic agents. Our evaluation shows that humans' performance is far beyond the agents' performance. Some agents, even with good normal task performance, perform significantly worse when there is a novelty, and the agents that can adapt to novelties typically adapt slower than humans. We promote the development of intelligent agents capable of performing at the human level or above when operating in open-world physical environments. Benchmark website: https://github.com/phy-q/novphy.","NovPhy: A physical reasoning benchmark for open-world AI systems Due to the emergence of AI systems that interact with the physical environment, there is an increased interest in incorporating physical reasoning capabilities into those AI systems. But is it enough to only have physical reasoning capabilities to operate in a real physical environment? In the real world, we constantly face novel situations we have not encountered before. As humans, we are competent at successfully adapting to those situations. Similarly, an agent needs to have the ability to function under the impact of novelties in order to properly operate in an open-world physical environment. To facilitate the development of such AI systems, we propose a new benchmark, NovPhy, that requires an agent to reason about physical scenarios in the presence of novelties and take actions accordingly. The benchmark consists of tasks that require agents to detect and adapt to novelties in physical scenarios. To create tasks in the benchmark, we develop eight novelties representing a diverse novelty space and apply them to five commonly encountered scenarios in a physical environment, related to applying forces and motions such as rolling, falling, and sliding of objects. According to our benchmark design, we evaluate two capabilities of an agent: the performance on a novelty when it is applied to different physical scenarios and the performance on a physical scenario when different novelties are applied to it. We conduct a thorough evaluation with human players, learning agents, and heuristic agents. Our evaluation shows that humans' performance is far beyond the agents' performance. Some agents, even with good normal task performance, perform significantly worse when there is a novelty, and the agents that can adapt to novelties typically adapt slower than humans. We promote the development of intelligent agents capable of performing at the human level or above when operating in open-world physical environments. Benchmark website: https://github.com/phy-q/novphy.",2
https://openalex.org/W4401630396,2024,Addressing maximization bias in reinforcement learning with two-sample testing,,Addressing maximization bias in reinforcement learning with two-sample testing,2
https://openalex.org/W4403936153,2024,Chimeric U-Net – Modifying the standard U-Net towards explainability,,Chimeric U-Net – Modifying the standard U-Net towards explainability,2
https://openalex.org/W4403936213,2024,Integrating multi-armed bandit with local search for MaxSAT,,Integrating multi-armed bandit with local search for MaxSAT,2
https://openalex.org/W4404919119,2024,A simple yet effective self-debiasing framework for transformer models,,A simple yet effective self-debiasing framework for transformer models,2
https://openalex.org/W4406972882,2025,Improved metric distortion via threshold approvals,,Improved metric distortion via threshold approvals,2
https://openalex.org/W4410022436,2025,Deep optimal transport for domain adaptation on SPD manifolds,"Recent progress in geometric deep learning has drawn increasing attention from the machine learning community toward domain adaptation on symmetric positive definite (SPD) manifolds—especially for neuroimaging data that often suffer from distribution shifts across sessions. These data, typically represented as covariance matrices of brain signals, inherently lie on SPD manifolds due to their symmetry and positive definiteness. However, conventional domain adaptation methods often overlook this geometric structure when applied directly to covariance matrices, which can result in suboptimal performance. To address this issue, we introduce a new geometric deep learning framework that combines optimal transport theory with the geometry of SPD manifolds. Our approach aligns data distributions while respecting the manifold structure, effectively reducing both marginal and conditional discrepancies. We validate our method on three cross-session brain-computer interface datasets—KU, BNCI2014001, and BNCI2015001—where it consistently outperforms baseline approaches while maintaining the intrinsic geometry of the data. We also provide quantitative results and visualizations to better illustrate the behavior of the learned embeddings.","Deep optimal transport for domain adaptation on SPD manifolds Recent progress in geometric deep learning has drawn increasing attention from the machine learning community toward domain adaptation on symmetric positive definite (SPD) manifolds—especially for neuroimaging data that often suffer from distribution shifts across sessions. These data, typically represented as covariance matrices of brain signals, inherently lie on SPD manifolds due to their symmetry and positive definiteness. However, conventional domain adaptation methods often overlook this geometric structure when applied directly to covariance matrices, which can result in suboptimal performance. To address this issue, we introduce a new geometric deep learning framework that combines optimal transport theory with the geometry of SPD manifolds. Our approach aligns data distributions while respecting the manifold structure, effectively reducing both marginal and conditional discrepancies. We validate our method on three cross-session brain-computer interface datasets—KU, BNCI2014001, and BNCI2015001—where it consistently outperforms baseline approaches while maintaining the intrinsic geometry of the data. We also provide quantitative results and visualizations to better illustrate the behavior of the learned embeddings.",2
https://openalex.org/W4412736565,2025,Social behavior as a key to learning-based multi-agent pathfinding dilemmas,,Social behavior as a key to learning-based multi-agent pathfinding dilemmas,2
https://openalex.org/W2275001223,2019,The logic of qualitative probability,,The logic of qualitative probability,8
https://openalex.org/W2883116389,2020,On strengthening the logic of iterated belief revision: Proper ordinal interval operators,,On strengthening the logic of iterated belief revision: Proper ordinal interval operators,8
https://openalex.org/W2791364807,2018,Parallelizing SMT solving: Lazy decomposition and conciliation,,Parallelizing SMT solving: Lazy decomposition and conciliation,4
https://openalex.org/W3165048240,2023,Epistemic uncertainty aware semantic localization and mapping for inference and belief space planning,,Epistemic uncertainty aware semantic localization and mapping for inference and belief space planning,4
https://openalex.org/W2899960748,2022,Modular materialisation of Datalog programs,"Answering queries over large datasets extended with Datalog rules plays a key role in numerous data management applications, and it has been implemented in several highly optimised Datalog systems in both academic and commercial contexts. Many systems implement reasoning via materialisation, which involves precomputing all consequences of the rules and the dataset in a preprocessing step. Some systems also use incremental reasoning algorithms, which can update the materialisation efficiently when the input dataset changes. Such techniques allow queries to be processed without any reference to the rules, so they are often used in applications where the performance of query answering is critical. Existing materialisation and incremental reasoning techniques enumerate all possible ways to apply rules to the data in order to derive all relevant consequences. This, however, can be inefficient because derivations of rules commonly used in practice are redundant; for example, rules axiomatising a binary predicate as symmetric and transitive can have a cubic number of applications, yet they can derive at most a quadratic number of facts. Such redundancy can be a significant source of overhead in practice and can prevent Datalog systems from successfully processing large datasets. To address this issue, in this paper we present a novel framework for modular materialisation and incremental reasoning. Our key idea is that, for certain combinations of rules commonly used in practice, all consequences can be derived using specialised procedures that do not necessarily enumerate all possible rule applications. Thus, our framework supports materialisation and incremental reasoning via a collection of modules. Each module is responsible for deriving consequences of a subset of the program, by using either standard rule application or proprietary algorithms. We prove that such an approach is complete as long as each module satisfies certain properties. Our formalisation of a module is very general, and in fact it allows modules to keep arbitrary auxiliary information. We also show how to realise custom procedures for four types of modules: transitivity, symmetry–transitivity, chain rules, and sequencing elements of a total order. Finally, we demonstrate empirically that using our custom procedures can speed up materialisation and incremental reasoning by several orders of magnitude on several well-known benchmarks. Thus, our technique has the potential to significantly improve the scalability of Datalog reasoners.","Modular materialisation of Datalog programs Answering queries over large datasets extended with Datalog rules plays a key role in numerous data management applications, and it has been implemented in several highly optimised Datalog systems in both academic and commercial contexts. Many systems implement reasoning via materialisation, which involves precomputing all consequences of the rules and the dataset in a preprocessing step. Some systems also use incremental reasoning algorithms, which can update the materialisation efficiently when the input dataset changes. Such techniques allow queries to be processed without any reference to the rules, so they are often used in applications where the performance of query answering is critical. Existing materialisation and incremental reasoning techniques enumerate all possible ways to apply rules to the data in order to derive all relevant consequences. This, however, can be inefficient because derivations of rules commonly used in practice are redundant; for example, rules axiomatising a binary predicate as symmetric and transitive can have a cubic number of applications, yet they can derive at most a quadratic number of facts. Such redundancy can be a significant source of overhead in practice and can prevent Datalog systems from successfully processing large datasets. To address this issue, in this paper we present a novel framework for modular materialisation and incremental reasoning. Our key idea is that, for certain combinations of rules commonly used in practice, all consequences can be derived using specialised procedures that do not necessarily enumerate all possible rule applications. Thus, our framework supports materialisation and incremental reasoning via a collection of modules. Each module is responsible for deriving consequences of a subset of the program, by using either standard rule application or proprietary algorithms. We prove that such an approach is complete as long as each module satisfies certain properties. Our formalisation of a module is very general, and in fact it allows modules to keep arbitrary auxiliary information. We also show how to realise custom procedures for four types of modules: transitivity, symmetry–transitivity, chain rules, and sequencing elements of a total order. Finally, we demonstrate empirically that using our custom procedures can speed up materialisation and incremental reasoning by several orders of magnitude on several well-known benchmarks. Thus, our technique has the potential to significantly improve the scalability of Datalog reasoners.",3
https://openalex.org/W3013151085,2020,"Designing normative theories for ethical and legal reasoning: LogiKEy framework, methodology, and tool support",,"Designing normative theories for ethical and legal reasoning: LogiKEy framework, methodology, and tool support",3
https://openalex.org/W3035412427,2020,Interpretable time series kernel analytics by pre-image estimation,,Interpretable time series kernel analytics by pre-image estimation,3
https://openalex.org/W3122866128,2021,Learning Modulo Theories for constructive preference elicitation,,Learning Modulo Theories for constructive preference elicitation,3
https://openalex.org/W4297141950,2022,Actions of the hyperoctahedral group to compute minimal contractors,,Actions of the hyperoctahedral group to compute minimal contractors,3
https://openalex.org/W4320475026,2023,Fast certifiable relative pose estimation with gravity prior,,Fast certifiable relative pose estimation with gravity prior,3
https://openalex.org/W4361288402,2023,Automated streamliner portfolios for constraint satisfaction problems,,Automated streamliner portfolios for constraint satisfaction problems,3
https://openalex.org/W2519295952,2016,Computing and restoring global inverse consistency in interactive constraint satisfaction,,Computing and restoring global inverse consistency in interactive constraint satisfaction,2
https://openalex.org/W3017203522,2020,On quasi-inconsistency and its complexity,,On quasi-inconsistency and its complexity,2
https://openalex.org/W3127858541,2021,New width parameters for SAT and #SAT,"We study the parameterized complexity of the propositional satisfiability (SAT) and the more general model counting (#SAT) problems and obtain novel fixed-parameter algorithms that exploit the structural properties of input formulas. In the first part of the paper, we parameterize by the treewidth of the following two graphs associated with CNF formulas: the consensus graph and the conflict graph. Both graphs have as vertices the clauses of the formula; in the consensus graph two clauses are adjacent if they do not contain a complementary pair of literals, while in the conflict graph two clauses are adjacent if they do contain a complementary pair of literals. We show that #SAT is fixed-parameter tractable when parameterized by the treewidth of the former graph, but SAT is W[1]-hard when parameterized by the treewidth of the latter graph. In the second part of the paper, we turn our attention to a novel structural parameter we call h-modularity which is loosely inspired by the well-established notion of community structure. The new parameter is defined in terms of a partition of clauses of the given CNF formula into strongly interconnected communities which are sparsely interconnected with each other. Each community forms a hitting formula, whereas the interconnections between communities form a graph of small treewidth. Our algorithms first identify the community structure and then use them for an efficient solution of SAT and #SAT, respectively.","New width parameters for SAT and #SAT We study the parameterized complexity of the propositional satisfiability (SAT) and the more general model counting (#SAT) problems and obtain novel fixed-parameter algorithms that exploit the structural properties of input formulas. In the first part of the paper, we parameterize by the treewidth of the following two graphs associated with CNF formulas: the consensus graph and the conflict graph. Both graphs have as vertices the clauses of the formula; in the consensus graph two clauses are adjacent if they do not contain a complementary pair of literals, while in the conflict graph two clauses are adjacent if they do contain a complementary pair of literals. We show that #SAT is fixed-parameter tractable when parameterized by the treewidth of the former graph, but SAT is W[1]-hard when parameterized by the treewidth of the latter graph. In the second part of the paper, we turn our attention to a novel structural parameter we call h-modularity which is loosely inspired by the well-established notion of community structure. The new parameter is defined in terms of a partition of clauses of the given CNF formula into strongly interconnected communities which are sparsely interconnected with each other. Each community forms a hitting formula, whereas the interconnections between communities form a graph of small treewidth. Our algorithms first identify the community structure and then use them for an efficient solution of SAT and #SAT, respectively.",2
